{
  "schemaVersion": 1,
  "profileId": "ready-for-agent-handoff-v1",
  "lifecycle": {
    "fieldName": "Agent Brief Lifecycle",
    "readyForAgentValue": "Ready for Agent"
  },
  "approval": {
    "approvedBy": {
      "fieldName": "Brief Approved By",
      "constraint": {
        "constraintId": "redmine-principal-v1",
        "valueType": "string",
        "required": true,
        "representation": "redmine-user:<positive-base10-integer>",
        "pattern": "^redmine-user:[1-9][0-9]*$",
        "allowEmpty": false
      }
    },
    "approvedAt": {
      "fieldName": "Brief Approved At",
      "constraint": {
        "constraintId": "rfc3339-offset-timestamp-v1",
        "valueType": "string",
        "required": true,
        "representation": "RFC3339 timestamp with Z or numeric offset",
        "format": "rfc3339-offset-timestamp",
        "pattern": "^[0-9]{4}-[0-9]{2}-[0-9]{2}T[0-9]{2}:[0-9]{2}:[0-9]{2}(?:\\.[0-9]+)?(?:Z|[+-][0-9]{2}:[0-9]{2})$",
        "allowEmpty": false
      }
    },
    "approvedBriefRevision": {
      "fieldName": "Approved Brief Revision",
      "constraint": {
        "constraintId": "positive-safe-base10-integer-v1",
        "valueType": "string",
        "required": true,
        "representation": "positive base-10 integer without sign or leading zero",
        "pattern": "^[1-9][0-9]*$",
        "minimum": 1,
        "allowEmpty": false
      }
    },
    "approvedPersistedRevision": {
      "fieldName": "Approved Persisted Revision",
      "constraint": {
        "constraintId": "nonblank-opaque-string-v1",
        "valueType": "string",
        "required": true,
        "representation": "opaque nonblank string",
        "allowEmpty": false
      }
    },
    "approvedRequirementsFingerprint": {
      "fieldName": "Approved Req Fingerprint",
      "constraint": {
        "constraintId": "sha256-lowercase-hex-v1",
        "valueType": "string",
        "required": true,
        "representation": "sha256:<64 lowercase hexadecimal characters>",
        "pattern": "^sha256:[0-9a-f]{64}$",
        "allowEmpty": false
      }
    }
  },
  "customFieldSemantics": {
    "scalarRequired": true,
    "uniqueExactNameRequired": true
  },
  "handoffIdentity": {
    "requiredFields": [
      "repository",
      "redmine_issue_id",
      "brief_revision",
      "persisted_revision",
      "requirements_fingerprint",
      "approver_identity",
      "approved_at"
    ]
  },
  "requirementsFingerprint": {
    "contractId": "agent-brief-requirements-fingerprint",
    "format": "sha256:<64 lowercase hexadecimal characters>",
    "inputFormatVersion": 1,
    "canonicalizationSemantics": "Phase 39 canonical JSON serialization derived from the bounded Phase 36 generation input; SHA-256 over UTF-8 bytes; updated_on is not a freshness signal"
  },
  "constraints": {
    "redmine-principal-v1": {
      "valueType": "string",
      "positive": ["redmine-user:1", "redmine-user:42"],
      "negative": ["", "redmine-user:0", "redmine-user:-1", "Redmine-user:42", "user:42"]
    },
    "rfc3339-offset-timestamp-v1": {
      "valueType": "string",
      "positive": ["2026-09-22T00:00:00Z", "2026-09-22T09:00:00+09:00", "2026-09-22T09:00:00.123+09:00"],
      "negative": ["", "2026-09-22", "2026-09-22T09:00:00", "2026/09/22 09:00:00+09:00"]
    },
    "positive-safe-base10-integer-v1": {
      "valueType": "string",
      "positive": ["1", "42", "9007199254740991"],
      "negative": ["", "0", "-1", "+1", "01", "1.0", "9007199254740992"]
    },
    "nonblank-opaque-string-v1": {
      "valueType": "string",
      "positive": ["opaque-persisted-revision", "a"],
      "negative": ["", " ", "\t", "\n"]
    },
    "sha256-lowercase-hex-v1": {
      "valueType": "string",
      "positive": ["sha256:aaaaaaaaaaaaaaaaaaaaaaaaaaaaaaaaaaaaaaaaaaaaaaaaaaaaaaaaaaaaaaaa"],
      "negative": ["", "aaaaaaaaaaaaaaaaaaaaaaaaaaaaaaaaaaaaaaaaaaaaaaaaaaaaaaaaaaaaaaaa", "sha256:AAAAAAAAAAAAAAAAAAAAAAAAAAAAAAAAAAAAAAAAAAAAAAAAAAAAAAAAAAAAAAAA", "sha256:abc", "sha256:gggggggggggggggggggggggggggggggggggggggggggggggggggggggggggggggg"]
    }
  },
  "contractReferences": [
    { "contractId": "agent-brief-release-handoff", "semanticRevision": 1 },
    { "contractId": "agent-brief-lifecycle", "semanticRevision": 1 },
    { "contractId": "agent-brief-redmine-mapping", "semanticRevision": 1 },
    { "contractId": "agent-brief-requirements-fingerprint", "semanticRevision": 1 }
  ]
}
